<?xml version="1.0" encoding="UTF-8"?>
<tc:testcase xmlns:tc="http://restsql.org/schema" xmlns:xsi="http://www.w3.org/2001/XMLSchema-instance"
	xsi:schemaLocation="http://restsql.org/schema ServiceTestCaseDefinition.xsd ">
	<setup>
		<sql>INSERT INTO film (film_id,title,release_year,language_id,rental_duration,rental_rate,replacement_cost) VALUES (5000,'ESCAPE FROM TOMORROW',2011,1,0,0,0)</sql>
		<sql>INSERT INTO film (film_id,title,release_year,language_id,rental_duration,rental_rate,replacement_cost) VALUES (5001,'BLOOD PURPLE',2012,1,0,0,0)</sql>
		<sql>INSERT INTO film (film_id,title,release_year,language_id,rental_duration,rental_rate,replacement_cost) VALUES (5002,'THE DARKENING',2012,1,0,0,0)</sql>
		<sql>INSERT INTO film_rating (film_rating_id,film_id,stars) VALUES (1,5000,5)</sql>
		<sql>INSERT INTO film_rating (film_rating_id,film_id,stars) VALUES (2,5001,1)</sql>
		<sql>INSERT INTO film_rating (film_rating_id,film_id,stars) VALUES (3,5002,1)</sql>
	</setup>
	<step name="execute">
		<request method="DELETE" uri="res/FlatOneToOne?year=2012" />
		<response>
			<body>
<![CDATA[
<writeResponse rowsAffected="2" />
]]>
				</body>
		</response>
	</step>
	<step name="verify">
		<request uri="res/FlatOneToOne?year=2012" method="GET" />
		<response>
			<body>
<![CDATA[
<readResponse>
</readResponse>
]]>
		</body>
		</response>
	</step>
	<step name="verify2">
		<request uri="res/SingleTable_FilmRating" method="GET" />
		<response>
			<body>
<![CDATA[
<readResponse>
	<film_rating film_rating_id="1" film_id="5000" stars="5" />
</readResponse>
]]>
		</body>
		</response>
	</step>
	<teardown>
		<sql>DELETE FROM film_rating</sql>
		<sql>DELETE FROM film WHERE film_id between 5000 and 5500</sql>
	</teardown>
</tc:testcase>
