<?xml version="1.0" encoding="UTF-8"?>
<tc:testcase xmlns:tc="http://restsql.org/schema" xmlns:xsi="http://www.w3.org/2001/XMLSchema-instance"
	xsi:schemaLocation="http://restsql.org/schema ServiceTestCaseDefinition.xsd ">
	<setup>
		<sql>INSERT INTO actor (actor_id,first_name,last_name) VALUES (1000,'John','Smith')</sql>
	</setup>
	<step name="execute">
		<request method="DELETE" uri="res/SingleTable/1000" user="limited" password="limited" />
		<response status="403" />
	</step>
	<teardown>
		<sql>DELETE FROM actor where actor_id between 1000 and 1100</sql>
	</teardown>
</tc:testcase>
