<?xml version="1.0" encoding="UTF-8"?>
<tc:testcase xmlns:tc="http://restsql.org/schema" xmlns:xsi="http://www.w3.org/2001/XMLSchema-instance"
	xsi:schemaLocation="http://restsql.org/schema ServiceTestCaseDefinition.xsd ">
	<setup>
		<sql>INSERT INTO actor (actor_id,first_name,last_name,last_update) VALUES (1000,'John','Sm','2012-02-15 04:34:33.0')</sql>
		<sql>INSERT INTO actor (actor_id,first_name,last_name,last_update) VALUES (1001,'Sally','Sm','2012-02-15 04:34:33.0')</sql>
	</setup>
	<step name="execute">
		<request method="DELETE" uri="res/SingleTableFuncCols?surname_length=2" />
		<response status="400">
			<body>
<![CDATA[
Column surname_length is read-only and may not be a query parameter or updated
]]>
		</body>
		</response>
	</step>
	<teardown>
		<sql>DELETE FROM actor where actor_id between 1000 and 1100</sql>
	</teardown>
</tc:testcase>
